{
  "language": "zh",
  "language_probability": 0.99,
  "duration": 15.0,
  "duration_after_vad": 10.2,
  "segments": [
    {
      "id": 1,
      "start": 2.1,
      "end": 5.8,
      "text": "最近看到一条关于 Skill 的讨论",
      "words": [
        {"start": 2.1, "end": 2.5, "word": "最近", "probability": 0.98},
        {"start": 4.9, "end": 5.8, "word": "Skill", "probability": 0.86}
      ]
    }
  ]
}
